{
  "type": "product",
  "product_id": "pop-mart--the-monsters--labubu--exciting-macaron--blind-box-set--sealed--20241027",
  "brand": "pop-mart",
  "line": "the-monsters",
  "character": "labubu",
  "series": "exciting-macaron",
  "form": "blind-box-set",
  "variant": "sealed",
  "edition": {
    "kind": "collab"
  },
  "distribution": {
    "region_lock": false,
    "markets": [
      "US"
    ]
  },
  "release_date": "2024-10-27",
  "market_listings": [
    {
      "market": "US",
      "currency": "USD",
      "price": 131.94
    }
  ],
  "availability": {
    "limited": false,
    "unit_count": null
  },
  "images": [],
  "provenance_ref": "/content/archives/collectables/designer-toys/pop-mart/the-monsters/provenance/pop-mart--the-monsters--labubu--exciting-macaron--blind-box-set--sealed--20241027.jsonl",
  "confidence": 0.45,
  "notes": "Seeded from initial article; requires re-research."
}