{
  "type": "product",
  "product_id": "pop-mart--the-monsters--labubu--pronounce-be-fancy-now--plush--std--20240315",
  "brand": "pop-mart",
  "line": "the-monsters",
  "character": "labubu",
  "series": "pronounce-be-fancy-now",
  "form": "plush",
  "variant": "std",
  "edition": {
    "kind": "collab"
  },
  "distribution": {
    "region_lock": false,
    "markets": [
      "CN"
    ]
  },
  "release_date": "2024-03-15",
  "market_listings": [
    {
      "market": "CN",
      "currency": "CNY",
      "price": 599
    }
  ],
  "availability": {
    "limited": true,
    "unit_count": 6458
  },
  "images": [],
  "provenance_ref": "/content/archives/collectables/designer-toys/pop-mart/the-monsters/provenance/pop-mart--the-monsters--labubu--pronounce-be-fancy-now--plush--std--20240315.jsonl",
  "confidence": 0.45,
  "notes": "Seeded from initial article; requires re-research."
}