{
  "type": "product",
  "product_id": "pop-mart--the-monsters--labubu--dress-be-latte--plush--std--20231026",
  "brand": "pop-mart",
  "line": "the-monsters",
  "character": "labubu",
  "series": "dress-be-latte",
  "form": "plush",
  "variant": "std",
  "edition": {
    "kind": "core"
  },
  "distribution": {
    "region_lock": false,
    "markets": [
      "CN"
    ]
  },
  "release_date": "2023-10-26",
  "market_listings": [
    {
      "market": "CN",
      "currency": "CNY",
      "price": 499
    }
  ],
  "availability": {
    "limited": false,
    "unit_count": null
  },
  "images": [],
  "provenance_ref": "/content/archives/collectables/designer-toys/pop-mart/the-monsters/provenance/pop-mart--the-monsters--labubu--dress-be-latte--plush--std--20231026.jsonl",
  "confidence": 0.45,
  "notes": "Seeded from initial article; requires re-research."
}