{
  "type": "product",
  "product_id": "pop-mart--the-monsters--spooky-boo--mischief-night--blind-box--single--20241015",
  "brand": "pop-mart",
  "line": "the-monsters",
  "character": "spooky-boo",
  "series": "mischief-night",
  "form": "blind-box",
  "variant": "single",
  "edition": { "kind": "core" },
  "distribution": { "region_lock": false, "markets": ["GLOBAL"] },
  "release_date": "2024-10-15",
  "market_listings": [],
  "availability": { "limited": false },
  "images": [],
  "provenance_ref": "/content/archives/collectables/designer-toys/pop-mart/the-monsters/provenance/pop-mart--the-monsters--spooky-boo--mischief-night--blind-box--single--20241015.jsonl",
  "confidence": 0.2,
  "notes": "Initial stub; price and specifics require confirmation."
}
