{
  "availability": {
    "limited": false,
    "unit_count": null
  },
  "brand": "pop-mart",
  "character": "mokoko",
  "confidence": 0.2,
  "distribution": {
    "markets": [
      "CN"
    ],
    "region_lock": false
  },
  "edition": {
    "kind": "core"
  },
  "form": "pendant",
  "images": [],
  "line": "the-monsters",
  "market_listings": [
    {
      "currency": "CNY",
      "market": "CN",
      "price": 159
    }
  ],
  "notes": "Network fetch failed; pending verification.",
  "product_id": "pop-mart--the-monsters--mokoko--close-to-sweet-v1--pendant--std--17cm",
  "provenance_ref": "/content/archives/collectables/designer-toys/pop-mart/the-monsters/provenance/pop-mart--the-monsters--mokoko--close-to-sweet-v1--pendant--std--17cm.jsonl",
  "series": "close-to-sweet-v1",
  "size": {
    "h": 17,
    "unit": "cm"
  },
  "type": "product",
  "variant": "std"
}
