{
  "type": "product",
  "product_id": "pop-mart--the-monsters--mokoko--twinkly-fairy-tale--pendant--std--17cm--20241128",
  "brand": "pop-mart",
  "line": "the-monsters",
  "character": "mokoko",
  "series": "twinkly-fairy-tale",
  "form": "pendant",
  "variant": "std",
  "edition": {
    "kind": "core"
  },
  "distribution": {
    "region_lock": false,
    "markets": [
      "CN"
    ]
  },
  "size": {
    "unit": "cm",
    "h": 17
  },
  "release_date": "2024-11-28",
  "market_listings": [
    {
      "market": "CN",
      "currency": "CNY",
      "price": 159
    }
  ],
  "availability": {
    "limited": false,
    "unit_count": null
  },
  "images": [],
  "provenance_ref": "/content/archives/collectables/designer-toys/pop-mart/the-monsters/provenance/pop-mart--the-monsters--mokoko--twinkly-fairy-tale--pendant--std--17cm--20241128.jsonl",
  "confidence": 0.45,
  "notes": "Seeded from initial article; requires re-research."
}